所属主题,文章数量,特征词,主题强度
Topic0,550,音效、屏幕、外观、流畅、苹果、灵动、不错、效果、像素、特色、黑色、视频、丝滑、信号、功能、细腻、电池、感觉、很棒、手机,0.068027
Topic1,1082,效果、外形、速度、待机时间、外观、清晰、屏幕、特色、静音、舒服、续航、不错、冷暖、完美、手机、空调、系统、功能、品牌、白色,0.13383
Topic2,1870,不错、质量、物流、速度、东西、购物、价格、京东、鸡腿、性价比、味道、发货、宝贝、很好、卖家、产品、品牌、仔细、感觉、很棒,0.23129
Topic3,1039,手机、手感、速度、系统、屏幕、外观、京东、酸奶、紫色、不错、音质、大气、发货、体验、苹果、颜色、习惯、很棒、白色、客服,0.12851
Topic4,1112,京东、苹果、不错、信赖、外观、物流、速度、品质、时效、下单、老婆、正品、手机、舒服、商品、外观设计、品牌、体验、购物、外形,0.13754
Topic5,2432,空调、师傅、漂亮、质感、专业、格力、奥克斯、外观、不错、耐用、素质、降价、很漂亮、外形、耐心、客服、速度、美的、时间、售后,0.3008
